{
  "schema_version": 1,
  "skill_name": "huggingface-papers",
  "status": "pending",
  "suite_canonical_sha256": "bc07368aa8fbb0eb47602e91f9cf8c56cb1847e4cd94507b6c15bff861be57d6",
  "harness_profile_canonical_sha256": "fbd2f7434a560213da902393c4f430a9164f714c085fa51e175af9b019a97509",
  "aggregate_report_sha256": "PENDING-COORDINATOR-SEAL",
  "evaluated_at": null,
  "expires_at": null,
  "harnesses": [
    {
      "harness": "cursor",
      "status": "pending",
      "evidence_sha256": "PENDING-COORDINATOR-SEAL",
      "reason": null
    },
    {
      "harness": "antigravity",
      "status": "pending",
      "evidence_sha256": "PENDING-COORDINATOR-SEAL",
      "reason": null
    },
    {
      "harness": "codex",
      "status": "pending",
      "evidence_sha256": "PENDING-COORDINATOR-SEAL",
      "reason": null
    },
    {
      "harness": "claude-code",
      "status": "pending",
      "evidence_sha256": "PENDING-COORDINATOR-SEAL",
      "reason": null
    }
  ]
}
