{
  "schema_version": 1,
  "skill_name": "hf-mem",
  "status": "pending",
  "suite_canonical_sha256": "c69bbb06f41635ecdfa3b3f30509c6a55034afd7ad2a2984caf6b729e94d8164",
  "harness_profile_canonical_sha256": "fbd2f7434a560213da902393c4f430a9164f714c085fa51e175af9b019a97509",
  "aggregate_report_sha256": "PENDING-COORDINATOR-SEAL",
  "evaluated_at": null,
  "expires_at": null,
  "harnesses": [
    {
      "harness": "cursor",
      "status": "pending",
      "evidence_sha256": "PENDING-COORDINATOR-SEAL",
      "reason": null
    },
    {
      "harness": "antigravity",
      "status": "pending",
      "evidence_sha256": "PENDING-COORDINATOR-SEAL",
      "reason": null
    },
    {
      "harness": "codex",
      "status": "pending",
      "evidence_sha256": "PENDING-COORDINATOR-SEAL",
      "reason": null
    },
    {
      "harness": "claude-code",
      "status": "pending",
      "evidence_sha256": "PENDING-COORDINATOR-SEAL",
      "reason": null
    }
  ]
}
