{
  "schema_version": 1,
  "skill_name": "huggingface-community-evals",
  "status": "pending",
  "suite_canonical_sha256": "8ec0ea12ed4fee2f963c8064783944f9ea451de8ad4520434fd5beb0ed5f1f33",
  "harness_profile_canonical_sha256": "fbd2f7434a560213da902393c4f430a9164f714c085fa51e175af9b019a97509",
  "aggregate_report_sha256": "PENDING-COORDINATOR-SEAL",
  "evaluated_at": null,
  "expires_at": null,
  "harnesses": [
    {
      "harness": "cursor",
      "status": "pending",
      "evidence_sha256": "PENDING-COORDINATOR-SEAL",
      "reason": null
    },
    {
      "harness": "antigravity",
      "status": "pending",
      "evidence_sha256": "PENDING-COORDINATOR-SEAL",
      "reason": null
    },
    {
      "harness": "codex",
      "status": "pending",
      "evidence_sha256": "PENDING-COORDINATOR-SEAL",
      "reason": null
    },
    {
      "harness": "claude-code",
      "status": "pending",
      "evidence_sha256": "PENDING-COORDINATOR-SEAL",
      "reason": null
    }
  ]
}
